{
  "event_name": "checkout_order_complete",
  "schema_version": 1,
  "event_type": "custom",
  "description": "订单支付完成并生成结算单",
  "owner": "team-payment",
  "trigger": "支付回调校验通过、结算单落库成功后上报一次",
  "priority": "critical",
  "critical_reason": "结算与对账的唯一数据源，丢失后没有其他数据可以补回",
  "status": "active",
  "app_ids": [
    "demo-app"
  ],
  "fields": [
    {
      "name": "order_type",
      "kind": "dimension",
      "type": "enum",
      "required": true,
      "description": "字段 order_type 的占位说明",
      "sensitivity": "none",
      "enum_values": [
        "normal",
        "group"
      ]
    },
    {
      "name": "channel",
      "kind": "dimension",
      "type": "string",
      "required": true,
      "description": "字段 channel 的占位说明",
      "sensitivity": "none",
      "max_length": 32
    },
    {
      "name": "amount_ratio",
      "kind": "metric",
      "type": "number",
      "required": true,
      "description": "实付金额占标价的比值",
      "unit": "ratio",
      "sensitivity": "none",
      "minimum": 0,
      "maximum": 1
    }
  ]
}
